<?xml version="1.0" encoding="UTF-8"?>
<users xmlns:xsi="http://www.w3.org/2001/XMLSchema-instance"
       xsi:noNamespaceSchemaLocation="User.xsd">
    <user>
        <username>johndoe</username>
        <email>johndoe@example.com</email>
        <password>password123</password>
        <registration_date>2023-06-12</registration_date>
    </user>
    <user>
        <username>janedoe</username>
        <email>janedoe@example.com</email>
        <password>pass4321</password>
        <registration_date>2023-06-10</registration_date>
    </user>
</users>